{
  "$schema": "http://json-schema.org/draft-07/schema#",
  "$id": "https://github.com/software-description-language/spec/layer_platform/platform-manifest.schema.json",
  "title": "SDL PlatformManifest",
  "description": "A PlatformManifest is the top-level Container at layer_platform. It describes the whole platform — all services visible as actors, the business domains they belong to, and the shared infrastructure they run on. One platform manifest per system (or per logical platform boundary). Typically generated by the synthesis tool from reading all service manifests, then human-edited for domain and infrastructure metadata.",
  "type": "object",
  "dl": {
    "profile": "software",
    "version": "0.1",
    "concepts": ["Container"],
    "layer": "schema",
    "layer_ref": "layer_platform",
    "perspectives": [
      {
        "name": "business",
        "role": "intent",
        "required": true,
        "description": "What the platform does — its purpose, the domains it covers, the key actors (services) involved. Written in plain language for architects and new team members."
      },
      {
        "name": "topology",
        "role": "implementation",
        "required": false,
        "description": "How the platform is deployed — shared infrastructure, network boundaries, team ownership. Technical context for engineers and ops."
      }
    ],
    "notes": "PlatformManifest = Container (the platform is the outermost Container in the SDL zoom chain). Each entry in services[] is a ServiceActor — a child Container representing a service at platform scope. PlatformConnect objects (inter-Container Connects) are materialized separately by the synthesis tool."
  },
  "required": ["dlVersion", "id", "label"],
  "additionalProperties": false,
  "properties": {
    "dlVersion": {
      "type": "string",
      "description": "The SDL spec version this file conforms to.",
      "pattern": "^\\d+\\.\\d+$",
      "examples": ["0.1"]
    },
    "id": {
      "type": "string",
      "description": "Unique kebab-case identifier for this platform.",
      "pattern": "^[a-z0-9][a-z0-9-_]*[a-z0-9]$",
      "examples": ["ecommerce-platform", "payments-platform", "identity-platform"]
    },
    "label": {
      "type": "string",
      "description": "Human-readable platform name.",
      "examples": ["E-Commerce Platform", "Payments Platform"]
    },
    "description": {
      "type": "string",
      "description": "One paragraph: what business capability this platform delivers, what domains it covers, who its primary users are."
    },
    "domains": {
      "type": "array",
      "description": "Business domains covered by this platform. Aligns with DDD bounded contexts.",
      "items": { "type": "string" },
      "examples": [["order-management", "payments", "inventory", "notifications", "fulfilment"]]
    },
    "services": {
      "type": "array",
      "description": "The services that make up this platform, each described as a ServiceActor — the platform-level view of that service.",
      "items": {
        "type": "object",
        "required": ["id", "label"],
        "additionalProperties": false,
        "properties": {
          "id": {
            "type": "string",
            "description": "Matches the 'id' in the service's own manifest.sdl.json. Used as a reference key by ServiceFlow steps and PlatformConnect objects.",
            "examples": ["order-service", "payment-service", "web-storefront"]
          },
          "label": {
            "type": "string",
            "description": "Human-readable service name.",
            "examples": ["Order Service", "Payment Service", "Web Storefront"]
          },
          "kind": {
            "type": "string",
            "description": "The broad category of this actor. Omit for standard backend services. Use 'frontend' for browser or mobile apps, 'external' for third-party systems modelled as platform actors, 'worker' for async/batch processes with no inbound REST interface.",
            "examples": ["frontend", "external", "worker"]
          },
          "domain": {
            "type": "string",
            "description": "Which domain this service belongs to.",
            "examples": ["order-management", "payments"]
          },
          "sdl_ref": {
            "type": "string",
            "description": "Path to this service's manifest.sdl.json, relative to the platform root.",
            "examples": ["./services/order-service/manifest.sdl.json", "../order-service/manifest.sdl.json"]
          },
          "exposes": {
            "type": "array",
            "description": "Interfaces this service exposes. Copied from the service manifest — protocol-prefixed notation.",
            "items": { "type": "string" },
            "examples": [["rest:POST /orders", "event:order.created"]]
          },
          "consumes": {
            "type": "array",
            "description": "Interfaces this service depends on. Copied from the service manifest.",
            "items": { "type": "string" },
            "examples": [["event:payment.completed"]]
          },
          "team": {
            "type": "string",
            "description": "Team or squad that owns this service.",
            "examples": ["team-checkout", "team-payments"]
          },
          "tags": {
            "type": "array",
            "items": { "type": "string" },
            "examples": [["critical-path", "pci-scope", "core-domain"]]
          }
        }
      }
    },
    "shared_infrastructure": {
      "type": "object",
      "description": "Infrastructure components shared across services in this platform.",
      "additionalProperties": false,
      "properties": {
        "message_broker": {
          "type": "object",
          "additionalProperties": false,
          "properties": {
            "kind":  { "type": "string", "enum": ["kafka", "rabbitmq", "sqs", "pubsub", "nats", "custom"] },
            "label": { "type": "string", "examples": ["Platform Kafka Cluster"] }
          }
        },
        "cache": {
          "type": "object",
          "additionalProperties": false,
          "properties": {
            "kind":  { "type": "string", "enum": ["redis", "memcached", "custom"] },
            "label": { "type": "string", "examples": ["Shared Redis Cluster"] }
          }
        },
        "service_mesh": {
          "type": "object",
          "additionalProperties": false,
          "properties": {
            "kind":  { "type": "string", "enum": ["istio", "linkerd", "consul", "none", "custom"] },
            "label": { "type": "string", "examples": ["Istio"] }
          }
        },
        "deployment_target": {
          "type": "string",
          "description": "Where the services are deployed.",
          "examples": ["kubernetes-prod-us-east-1", "aws-ecs", "cloud-run"]
        }
      }
    },
    "tags": {
      "type": "array",
      "items": { "type": "string" },
      "examples": [["b2c", "ecommerce", "pci-in-scope"]]
    },
    "stats": {
      "type": "object",
      "description": "Auto-generated summary counts. Populated by tooling.",
      "additionalProperties": false,
      "properties": {
        "services":       { "type": "integer", "minimum": 0 },
        "domains":        { "type": "integer", "minimum": 0 },
        "service_flows":  { "type": "integer", "minimum": 0 }
      }
    },
    "meta": {
      "type": "object",
      "additionalProperties": true
    }
  }
}
